{
  "$schema": "../../schemas/ticket.schema.json",
  "schemaVersion": 1,
  "id": "I18N-REACT",
  "title": "Internationalization (EN/VI) for the mango-ui React SPA",
  "status": "completed",
  "priority": "normal",
  "createdUtc": "2026-03-10T00:00:00Z",
  "updatedUtc": "2026-03-10T00:00:00Z",
  "completedUtc": "2026-03-10T00:00:00Z",
  "tags": ["frontend", "spa", "i18n"],
  "steps": [
    {
      "id": "step-1",
      "title": "Business analysis and technical planning",
      "done": true,
      "tasks": [
        { "id": "step-1.1", "title": "Analyse the requirement", "done": true },
        { "id": "step-1.2", "title": "Context search across UI components and the main flow", "done": true },
        { "id": "step-1.3", "title": "Write the technical blueprint", "done": true },
        { "id": "step-1.4", "title": "Blueprint approved by the user", "done": true }
      ]
    },
    {
      "id": "step-2",
      "title": "Component and page localization",
      "done": true,
      "tasks": [
        { "id": "step-2.1", "title": "Shared components: Navbar, ProductCard, SearchBox, Pagination, ChatPopup", "done": true },
        { "id": "step-2.2", "title": "Store pages: Products, ProductDetails, Cart, Checkout, Confirmation", "done": true },
        { "id": "step-2.3", "title": "Order pages: Orders, OrderDetails", "done": true },
        { "id": "step-2.4", "title": "Admin pages: AdminProducts, ProductFormModal, DeleteDialog", "done": true }
      ]
    },
    {
      "id": "step-3",
      "title": "Verification and quality",
      "done": true,
      "tasks": [
        { "id": "step-3.1", "title": "TypeScript build passes", "done": true },
        { "id": "step-3.2", "title": "Lint passes", "done": true },
        { "id": "step-3.3", "title": "Language switching tested manually in the dev server", "done": true }
      ]
    },
    {
      "id": "step-4",
      "title": "Documentation, memory and completion",
      "done": true,
      "tasks": [
        { "id": "step-4.1", "title": "i18n behaviour documented", "done": true },
        { "id": "step-4.2", "title": "Conventional commit created", "done": true },
        { "id": "step-4.3", "title": "Findings promoted into project memory", "done": true }
      ]
    }
  ],
  "blockers": [],
  "links": {
    "plan": ".agent/tickets/I18N-REACT/plan.md",
    "files": ["src/UI/mango-ui/src"],
    "docs": ["docs/frontend/i18n.md"],
    "memory": [".agent/memory/domains/frontend-spa.md"]
  },
  "notes": ".agent/tickets/I18N-REACT/notes.md"
}
