{
  "$schema": "../../schemas/ticket.schema.json",
  "schemaVersion": 1,
  "id": "UI-REDESIGN-001",
  "title": "Emerald Calm UI redesign — Identity.API and Mango.Web",
  "status": "completed",
  "priority": "normal",
  "createdUtc": "2026-03-10T00:00:00Z",
  "updatedUtc": "2026-03-10T19:55:00Z",
  "completedUtc": "2026-03-10T19:55:00Z",
  "tags": ["frontend", "razor", "design-system"],
  "steps": [
    {
      "id": "step-1",
      "title": "Business analysis and technical planning",
      "done": true,
      "doneUtc": "2026-03-10T00:00:00Z",
      "tasks": [
        { "id": "step-1.1", "title": "Run the analyze-requirement sub-workflow", "done": true },
        { "id": "step-1.2", "title": "Context search across Identity.API and Mango.Web views/CSS", "done": true },
        { "id": "step-1.3", "title": "Write the technical blueprint", "done": true },
        { "id": "step-1.4", "title": "Present theme/font/dark-mode/layout options to the user", "done": true },
        { "id": "step-1.5", "title": "Blueprint approved — Option C: Emerald Calm + Montserrat", "done": true }
      ]
    },
    {
      "id": "step-2",
      "title": "Implementation (full-stack)",
      "done": true,
      "doneUtc": "2026-03-10T00:00:00Z",
      "tasks": [
        { "id": "step-2.1", "title": "Identity.API: BEM design system, custom properties, dark/light tokens", "done": true },
        { "id": "step-2.2", "title": "Identity.API: layout, sticky nav, auth pages on .auth-card", "done": true },
        { "id": "step-2.3", "title": "Mango.Web: same tokens in a separate file, full BEM block set", "done": true },
        { "id": "step-2.4", "title": "Mango.Web: layout, LoginPartial, TempData alerts, dark toggle", "done": true },
        { "id": "step-2.5", "title": "Home, Product, Cart and Order views restyled", "done": true }
      ]
    },
    {
      "id": "step-3",
      "title": "Verification and quality",
      "done": true,
      "doneUtc": "2026-03-10T19:55:00Z",
      "tasks": [
        { "id": "step-3.1", "title": "dotnet build Identity.API and Mango.Web succeed", "done": true },
        { "id": "step-3.2", "title": "Fix 4 view bugs found during verification", "done": true },
        { "id": "step-3.3", "title": "Apply code-review fixes (checkout guard, XSS, line-clamp)", "done": true },
        {
          "id": "step-3.4",
          "title": "Run fix-warnings for C# 14 compiler warnings",
          "done": false,
          "skipped": true,
          "skipReason": "deferred at completion"
        }
      ]
    },
    {
      "id": "step-4",
      "title": "Documentation, memory and completion",
      "done": true,
      "doneUtc": "2026-03-10T19:55:00Z",
      "tasks": [
        { "id": "step-4.1", "title": "Blueprint written to plan.md", "done": true },
        { "id": "step-4.2", "title": "Conventional commit created", "done": true },
        { "id": "step-4.3", "title": "Findings promoted into project memory", "done": true }
      ]
    }
  ],
  "blockers": [],
  "links": {
    "plan": ".agent/tickets/UI-REDESIGN-001/plan.md",
    "files": [
      "src/Services/Identity.API/wwwroot/css/site.css",
      "src/Web/Mango.Web/wwwroot/css/site.css"
    ],
    "docs": [],
    "memory": [
      ".agent/memory/domains/ui-web.md",
      ".agent/memory/domains/cart-checkout.md"
    ]
  },
  "notes": ".agent/tickets/UI-REDESIGN-001/notes.md"
}
